{
  "brief_id": "frontline_study_9b09879a8430",
  "project_name": "Frontline Research",
  "problem_statement": "I want to learn whether solo founders understand a scheduling assistant concept and what would stop them from trying it.",
  "target_market": "Solo founders who manage sales calls and follow-up tasks themselves.",
  "offered_solution": "Decide whether to continue with this concept and what objections need human follow-up.",
  "validation_goal": "Decide whether to continue with this concept and what objections need human follow-up.",
  "pricing_hypothesis": "",
  "landing_page_text": "",
  "mvp_scope": "",
  "concierge_mvp_idea": "",
  "assumptions": [
    "objections",
    "trust_gaps",
    "adoption_barriers",
    "contradictions",
    "human_validation_gaps",
    "Recently handled sales calls or follow-up work",
    "Owns the workflow decision or strongly influences it",
    "What do you understand this assistant is meant to help with?",
    "Where would trust, effort, or setup risk stop you?",
    "What would you need to see before trying it?"
  ],
  "constraints": [
    "Persona panel: mainstream",
    "Selected persona ids: su_0003, su_0002, su_0001",
    "Audience exclusion: Do not treat synthetic participants as recruited market proof."
  ],
  "known_risks": [
    "Synthetic evidence requires human validation before market-proof claims."
  ]
}