{
  "brief_id": "frontline_study_6c26d4d798bc",
  "project_name": "Frontline Research",
  "problem_statement": "I need to test whether a founder concept is understandable, trusted, and worth trying.",
  "target_market": "Potential early adopters who match the problem context.",
  "offered_solution": "Decide whether this should move forward, what creates hesitation, and what needs human follow-up.",
  "validation_goal": "Decide whether this should move forward, what creates hesitation, and what needs human follow-up.",
  "pricing_hypothesis": "",
  "landing_page_text": "",
  "mvp_scope": "",
  "concierge_mvp_idea": "",
  "assumptions": [
    "objections",
    "trust_gaps",
    "adoption_barriers",
    "contradictions",
    "human_validation_gaps"
  ],
  "constraints": [],
  "known_risks": [
    "Synthetic evidence requires human validation before market-proof claims."
  ]
}