{
  "brief_id": "fixture_budget_constrained_offer_v1",
  "project_name": "Lean Task Board",
  "problem_statement": "Small operators lose track of recurring admin tasks when they rely on scattered notes and reminders.",
  "target_market": "Cost-conscious operators and coordinators who already feel subscription creep.",
  "offered_solution": "A simple task workflow board that collects notes and recurring admin tasks in one place.",
  "validation_goal": "Test whether a lightweight workflow product feels worth paying for in a budget-constrained audience.",
  "pricing_hypothesis": "$19 monthly subscription.",
  "landing_page_text": "Keep recurring admin tasks visible without adding another heavy tool.",
  "mvp_scope": "Capture tasks, organize recurring reminders, and review a weekly list.",
  "concierge_mvp_idea": "Founder manually structures task lists and sends back a cleaned-up board.",
  "assumptions": [
    "Users feel enough admin drag to try a simpler workflow."
  ],
  "constraints": [
    "Must prove value quickly before pricing feels reasonable."
  ],
  "known_risks": [
    "Users may resist another subscription."
  ]
}